{
  "schema_version": "1",
  "release_version": "v2.1.0",
  "release_id": "01J5K8N2PQRS4T6VWXYZ0ABCDE",
  "created_at": "2026-06-25T10:00:00Z",
  "source_revision": "abc123def456789012345678901234567890abcd",
  "components": {
    "services": {
      "scanalyze-ingest-api": {
        "image_digest": "sha256:aabbccdd11223344556677889900aabbccddeeff00112233445566778899aabb",
        "image_uri": "123456789012.dkr.ecr.us-east-1.amazonaws.com/scanalyze/ingest-api:v2.1.0"
      }
    },
    "modules": {
      "network": {
        "module_digest": "sha256:11223344556677889900aabbccddeeff00112233445566778899aabbccddeeff"
      }
    }
  },
  "toolchain": {
    "terraform_version": "1.12.1",
    "python_version": "3.11.12"
  },
  "signing": {
    "signing_algorithm": "ECDSA_SHA_256",
    "kms_key_arn": "arn:aws:kms:us-east-1:999999999999:key/mrk-signing-key-id",
    "signer_profile_arn": "arn:aws:signer:us-east-1:999999999999:/signing-profiles/ScanalyzeSigner"
  }
}
